{
 "schemaVersion": 1,
 "schemaId": "trs-jack-3d-source-verification-result.v1",
 "isSelfReport": true,
 "replacesRecipientVerification": false,
 "note": "**これは自己申告である。**こちらのリポジトリで verify:release-source-inputs を回した結果でしかなく、受け手の独立検証を置き換えない。**突き合わせ先は生成時の作業ツリーであって tag の source ではない。**tag は evidence をコミットした後に打つので、この時点では存在しない。受け手は同梱の verifyReleaseSourceInputs.mjs を tag に対して回すこと（howToVerifyYourself を参照）。",
 "tool": {
  "script": "scripts/verifyReleaseSourceInputs.mjs",
  "toolVersion": 20,
  "sha256": "da1e5558d0a4cdf38c23274c4486bbbbf94cc79bf02a28a49cd01765af325401"
 },
 "sourceOrigin": "directory:.",
 "generatedFromCommit": "e41738af164b8af280adc4aa2f13f2470cfa41cf",
 "releaseCommit": null,
 "generatedAt": "2026-10-18",
 "status": "OK",
 "exitCode": 0,
 "unrecordedInputDetection": {
  "performed": true,
  "scopeSource": "override:source-input-scope.v1.json"
 },
 "counts": {
  "checked": 32,
  "matched": 32,
  "mismatched": 0,
  "missingInSource": 0,
  "unrecordedInputCandidates": 0,
  "selfReferencingInputs": 0
 },
 "howToVerifyYourself": [
  "# bundle に同梱してある script をそのまま使う（通信しない）",
  "node verifyReleaseSourceInputs.mjs --manifest source-input-manifest.json --source <展開した source> --scope source-input-scope.v1.json",
  "# 手元に tag があるなら（これも通信しない）",
  "node verifyReleaseSourceInputs.mjs --manifest source-input-manifest.json --tag <tag> --scope source-input-scope.v1.json",
  "# 明示したときだけ GitHub から source を取る",
  "node verifyReleaseSourceInputs.mjs --manifest source-input-manifest.json --tag <tag> --fetch github --scope source-input-scope.v1.json",
  "# status は OK(0) / MISMATCH(1) / VERIFICATION_INCOMPLETE(1) / ARCHIVE_INVALID(2) / ARCHIVE_UNSUPPORTED(2) / SOURCE_UNAVAILABLE(2) / MANIFEST_UNAVAILABLE(2) / NOTHING_TO_VERIFY(2)。",
  "# 終了コード 3 は **この道具の欠陥** で、検証の結果ではありません（JSON を出さずに止まります）。",
  "# **取れなかった(2) と 合わなかった(1) を同じ失敗に潰さないこと。**",
  "# **unrecordedInputDetection.performed が false なら「候補 0 件」ではなく「探していない」。**"
 ]
}
